{
  "id": "T-0042",
  "exam": "denken3",
  "subject": "理論",
  "topic": "コイルの磁気エネルギー",
  "format": "numeric",
  "difficulty": 2,
  "params": {
    "inductance": {
      "value": 0.5,
      "unit": "H",
      "realistic_range": [
        0.1,
        2
      ]
    },
    "current": {
      "value": 4,
      "unit": "A",
      "realistic_range": [
        1,
        20
      ]
    }
  },
  "statement": "自己インダクタンス L=0.5H のコイルに電流 I=4A が流れている。蓄えられる磁気エネルギー W〔J〕は?",
  "answer": "4",
  "solution": [
    "磁気エネルギー W=(1/2)·L·I²",
    "W=0.5×0.5×4²",
    "W=4J"
  ],
  "validation": {
    "solver_checked": true,
    "human_checked": true,
    "clean_answer": true,
    "physically_valid": true,
    "supervisor_checked": false,
    "confidence": 0.97
  },
  "source": {
    "type": "original",
    "citation": "DENKEN-OS オリジナル問題"
  },
  "stats": {
    "answered": 0,
    "correct_rate": 0
  },
  "status": "validated"
}
