{
  "id": "T-0049",
  "exam": "denken2_primary",
  "subject": "電力",
  "topic": "不等率",
  "format": "numeric",
  "difficulty": 2,
  "params": {
    "sum_of_maxima": {
      "value": 150,
      "unit": "kW",
      "realistic_range": [
        100,
        300
      ]
    },
    "composite_max": {
      "value": 100,
      "unit": "kW",
      "realistic_range": [
        80,
        200
      ]
    }
  },
  "statement": "各需要家の最大需要電力の総和が 150kW、合成最大需要電力が 100kW である。不等率は?",
  "answer": "1.5",
  "solution": [
    "不等率=各最大需要の総和/合成最大需要（≧1）",
    "=150/100",
    "=1.5"
  ],
  "validation": {
    "solver_checked": true,
    "human_checked": true,
    "clean_answer": true,
    "physically_valid": true,
    "supervisor_checked": false,
    "confidence": 0.97
  },
  "source": {
    "type": "original",
    "citation": "DENKEN-OS オリジナル問題"
  },
  "stats": {
    "answered": 0,
    "correct_rate": 0
  },
  "status": "validated"
}
