{
  "id": "T-0010",
  "exam": "denken2_primary",
  "subject": "機械",
  "topic": "変圧器の効率",
  "format": "numeric",
  "difficulty": 3,
  "params": {
    "output_power": {
      "value": 950,
      "unit": "kW",
      "realistic_range": [
        300,
        2000
      ]
    },
    "iron_loss": {
      "value": 20,
      "unit": "kW",
      "realistic_range": [
        1,
        60
      ]
    },
    "copper_loss": {
      "value": 30,
      "unit": "kW",
      "realistic_range": [
        1,
        100
      ]
    }
  },
  "statement": "ある変圧器が出力 P_out=950kW で運転している。鉄損 P_i=20kW、銅損 P_c=30kW のとき、効率 η〔%〕は?",
  "answer": "95",
  "solution": [
    "η=P_out/(P_out+P_i+P_c)×100",
    "η=950/(950+20+30)×100",
    "η=95%"
  ],
  "validation": {
    "solver_checked": true,
    "human_checked": true,
    "clean_answer": true,
    "physically_valid": true,
    "supervisor_checked": false,
    "confidence": 0.97
  },
  "source": {
    "type": "original",
    "citation": "DENKEN-OS オリジナル問題"
  },
  "stats": {
    "answered": 0,
    "correct_rate": 0
  },
  "status": "validated"
}
