{
  "id": "T-0018",
  "exam": "denken2_secondary",
  "subject": "電力管理",
  "topic": "水力発電出力",
  "format": "descriptive",
  "difficulty": 3,
  "params": {
    "flow": {
      "value": 10,
      "unit": "m3/s",
      "realistic_range": [
        5,
        50
      ]
    },
    "head": {
      "value": 100,
      "unit": "m",
      "realistic_range": [
        20,
        200
      ]
    },
    "efficiency": {
      "value": 0.9,
      "unit": "",
      "realistic_range": [
        0.8,
        0.95
      ]
    }
  },
  "statement": "有効落差 H=100m、使用流量 Q=10m³/s、総合効率 η=0.9 の水力発電所がある。発電機出力 P〔kW〕を P=9.8QHη により導出過程とともに求めよ。",
  "answer": "8820",
  "solution": [
    "出力 P=9.8·Q·H·η〔kW〕（9.8=重力加速度に基づく係数）",
    "P=9.8×10×100×0.9",
    "P=8820kW"
  ],
  "validation": {
    "solver_checked": true,
    "human_checked": true,
    "clean_answer": true,
    "physically_valid": true,
    "supervisor_checked": false,
    "confidence": 0.97
  },
  "source": {
    "type": "original",
    "citation": "DENKEN-OS オリジナル問題"
  },
  "stats": {
    "answered": 0,
    "correct_rate": 0
  },
  "status": "validated"
}
