{
  "id": "T-0002",
  "exam": "denken2_secondary",
  "subject": "機械制御",
  "topic": "変圧器の電圧変動率",
  "format": "descriptive",
  "difficulty": 3,
  "params": {
    "percent_resistance": { "value": 2, "unit": "%", "realistic_range": [1, 5] },
    "percent_reactance": { "value": 5, "unit": "%", "realistic_range": [2, 15] },
    "power_factor": { "value": 0.8, "unit": "", "realistic_range": [0.5, 1] }
  },
  "statement": "定格運転中の変圧器で、%抵抗降下 p=2%、%リアクタンス降下 q=5%、負荷力率 cosθ=0.8（遅れ）である。電圧変動率 ε〔%〕を一次近似 ε≈p·cosθ+q·sinθ により求め、導出過程とともに示せ。",
  "answer": "4.6",
  "solution": [
    "sinθ=√(1−cos²θ)=√(1−0.8²)=0.6",
    "ε≈p·cosθ+q·sinθ=2×0.8+5×0.6",
    "ε=1.6+3.0=4.6%",
    "（補足: 二次項 (q·cosθ−p·sinθ)²/200 を含む厳密式もあるが、本問は一次近似で評価）"
  ],
  "validation": {
    "solver_checked": true,
    "human_checked": true,
    "clean_answer": true,
    "physically_valid": true,
    "supervisor_checked": false,
    "confidence": 0.95
  },
  "source": { "type": "original", "citation": "DENKEN-OS オリジナル問題" },
  "stats": { "answered": 0, "correct_rate": 0 },
  "status": "draft"
}
