{
  "id": "T-0029",
  "exam": "denken2_primary",
  "subject": "理論",
  "topic": "三相交流電力",
  "format": "multiple_choice",
  "difficulty": 2,
  "params": {
    "line_voltage": {
      "value": 400,
      "unit": "V",
      "realistic_range": [
        100,
        6600
      ]
    },
    "R": {
      "value": 8,
      "unit": "Ω",
      "realistic_range": [
        1,
        50
      ]
    },
    "X": {
      "value": 6,
      "unit": "Ω",
      "realistic_range": [
        1,
        50
      ]
    }
  },
  "statement": "平衡三相Y結線の負荷に線間電圧400Vを加えた。1相のインピーダンスがZ=8+j6Ωのとき三相有効電力P〔kW〕は?",
  "figure": "<svg xmlns=\"http://www.w3.org/2000/svg\" viewBox=\"0 0 240 130\" role=\"img\" aria-label=\"三相Y結線負荷 線間電圧400V、1相 Z=8+j6Ω\" font-family=\"system-ui,sans-serif\" font-size=\"13\"><title>三相Y結線負荷 線間電圧400V、1相 Z=8+j6Ω</title><g stroke=\"currentColor\" stroke-width=\"2\" fill=\"none\" stroke-linecap=\"round\" stroke-linejoin=\"round\"><circle cx=\"45\" cy=\"70\" r=\"22\" fill=\"none\"/><text x=\"45\" y=\"75\" fill=\"currentColor\" stroke=\"none\" text-anchor=\"middle\">3φ</text><text x=\"45\" y=\"108\" fill=\"currentColor\" stroke=\"none\" text-anchor=\"middle\">線間 400V</text><line x1=\"67\" y1=\"70\" x2=\"105\" y2=\"70\"/><circle cx=\"105\" cy=\"70\" r=\"3.2\" fill=\"currentColor\" stroke=\"none\"/><line x1=\"105\" y1=\"40\" x2=\"105\" y2=\"100\"/><line x1=\"105\" y1=\"40\" x2=\"120.75\" y2=\"40\"/><rect x=\"120.75\" y=\"31\" width=\"38.5\" height=\"18\" fill=\"none\"/><line x1=\"159.25\" y1=\"40\" x2=\"175\" y2=\"40\"/><text x=\"140\" y=\"26\" fill=\"currentColor\" stroke=\"none\" text-anchor=\"middle\">Z=8+j6</text><line x1=\"105\" y1=\"70\" x2=\"120.75\" y2=\"70\"/><rect x=\"120.75\" y=\"61\" width=\"38.5\" height=\"18\" fill=\"none\"/><line x1=\"159.25\" y1=\"70\" x2=\"175\" y2=\"70\"/><text x=\"140\" y=\"56\" fill=\"currentColor\" stroke=\"none\" text-anchor=\"middle\">Z</text><line x1=\"105\" y1=\"100\" x2=\"120.75\" y2=\"100\"/><rect x=\"120.75\" y=\"91\" width=\"38.5\" height=\"18\" fill=\"none\"/><line x1=\"159.25\" y1=\"100\" x2=\"175\" y2=\"100\"/><text x=\"140\" y=\"86\" fill=\"currentColor\" stroke=\"none\" text-anchor=\"middle\">Z</text><line x1=\"175\" y1=\"40\" x2=\"200\" y2=\"40\"/><line x1=\"175\" y1=\"70\" x2=\"200\" y2=\"70\"/><line x1=\"175\" y1=\"100\" x2=\"200\" y2=\"100\"/><line x1=\"200\" y1=\"40\" x2=\"200\" y2=\"100\"/><circle cx=\"200\" cy=\"70\" r=\"3.2\" fill=\"currentColor\" stroke=\"none\"/><text x=\"208\" y=\"74\" fill=\"currentColor\" stroke=\"none\">N</text></g></svg>",
  "choices": [
    "9.6",
    "10.24",
    "12.8",
    "16.0",
    "38.4"
  ],
  "answer": "12.8",
  "solution": [
    "|Z|=√(8²+6²)=10Ω",
    "力率cosφ=R/|Z|=0.8",
    "相電圧V_p=400/√3、相電流I=V_p/|Z|",
    "P=3·I²·R=12.8kW",
    "別解 P=√3·V_l·I_l·cosφ でも一致",
    "ポイント: Y結線は相電圧=線間/√3。√3 の入れ忘れが最頻ミス。"
  ],
  "validation": {
    "solver_checked": true,
    "human_checked": true,
    "clean_answer": true,
    "physically_valid": true,
    "supervisor_checked": false,
    "confidence": 0.97
  },
  "source": {
    "type": "original",
    "citation": "DENKEN-OS オリジナル問題"
  },
  "stats": {
    "answered": 0,
    "correct_rate": 0,
    "common_wrong_choice": "38.4"
  },
  "status": "validated"
}
