{
  "id": "T-0001",
  "exam": "denken2_primary",
  "subject": "理論",
  "topic": "三相交流電力",
  "format": "multiple_choice",
  "difficulty": 2,
  "params": {
    "line_voltage": { "value": 200, "unit": "V", "realistic_range": [100, 6600] },
    "R": { "value": 8, "unit": "ohm", "realistic_range": [1, 50] },
    "X": { "value": 6, "unit": "ohm", "realistic_range": [1, 50] }
  },
  "statement": "平衡三相Y結線の負荷に線間電圧200Vを加えた。1相のインピーダンスがZ=8+j6Ωのとき三相有効電力P〔kW〕は?",
  "choices": ["2.56", "3.2", "4.0", "9.6"],
  "answer": "3.2",
  "solution": [
    "|Z|=√(8²+6²)=10Ω",
    "力率cosφ=R/|Z|=0.8",
    "相電圧V_p=200/√3、相電流I=V_p/|Z|=20/√3 A",
    "P=3·I²·R=3·(400/3)·8=3200W=3.2kW",
    "別解 P=√3·V_l·I_l·cosφ=3200W で一致"
  ],
  "validation": {
    "solver_checked": true,
    "human_checked": true,
    "clean_answer": true,
    "physically_valid": true,
    "supervisor_checked": false,
    "confidence": 0.99
  },
  "source": { "type": "original", "citation": "DENKEN-OS オリジナル問題" },
  "stats": { "answered": 0, "correct_rate": 0, "common_wrong_choice": "9.6" },
  "status": "validated"
}
