{
  "id": "T-0041",
  "exam": "denken3",
  "subject": "機械",
  "topic": "直流発電機の誘導起電力",
  "format": "numeric",
  "difficulty": 2,
  "params": {
    "terminal_voltage": {
      "value": 220,
      "unit": "V",
      "realistic_range": [
        100,
        220
      ]
    },
    "armature_current": {
      "value": 50,
      "unit": "A",
      "realistic_range": [
        10,
        50
      ]
    },
    "armature_resistance": {
      "value": 0.2,
      "unit": "ohm",
      "realistic_range": [
        0.1,
        1
      ]
    }
  },
  "statement": "端子電圧 V=220V の直流発電機が電機子電流 Ia=50A を供給している。電機子抵抗 Ra=0.2Ω のとき、誘導起電力 E〔V〕は?",
  "answer": "230",
  "solution": [
    "発電機は E=V+Ia·Ra（電動機の E=V−Ia·Ra と符号が逆）",
    "E=220+50×0.2",
    "E=230V"
  ],
  "validation": {
    "solver_checked": true,
    "human_checked": true,
    "clean_answer": true,
    "physically_valid": true,
    "supervisor_checked": false,
    "confidence": 0.97
  },
  "source": {
    "type": "original",
    "citation": "DENKEN-OS オリジナル問題"
  },
  "stats": {
    "answered": 0,
    "correct_rate": 0
  },
  "status": "validated"
}
