{
  "id": "T-0007",
  "exam": "denken2_primary",
  "subject": "電力",
  "topic": "力率改善",
  "format": "numeric",
  "difficulty": 3,
  "params": {
    "load_power": {
      "value": 240,
      "unit": "kW",
      "realistic_range": [
        50,
        600
      ]
    },
    "power_factor_before": {
      "value": 0.8,
      "unit": "",
      "realistic_range": [
        0.5,
        1
      ]
    },
    "power_factor_after": {
      "value": 1,
      "unit": "",
      "realistic_range": [
        0.5,
        1
      ]
    }
  },
  "statement": "有効電力 P=240kW の負荷の力率を 0.8（遅れ）から 1 に改善したい。必要な進相コンデンサの容量 Qc〔kvar〕は?",
  "answer": "180",
  "solution": [
    "Qc=P·(tanθ1−tanθ2)",
    "tanθ1=0.75、tanθ2=0",
    "Qc=240×(0.75−0)=180kvar"
  ],
  "validation": {
    "solver_checked": true,
    "human_checked": true,
    "clean_answer": true,
    "physically_valid": true,
    "supervisor_checked": false,
    "confidence": 0.97
  },
  "source": {
    "type": "original",
    "citation": "DENKEN-OS オリジナル問題"
  },
  "stats": {
    "answered": 0,
    "correct_rate": 0
  },
  "status": "validated"
}
