{
  "id": "T-0006",
  "exam": "denken3",
  "subject": "理論",
  "topic": "ホイートストンブリッジ",
  "format": "numeric",
  "difficulty": 2,
  "params": {
    "r1": {
      "value": 100,
      "unit": "ohm",
      "realistic_range": [
        10,
        200
      ]
    },
    "r2": {
      "value": 200,
      "unit": "ohm",
      "realistic_range": [
        100,
        500
      ]
    },
    "r3": {
      "value": 150,
      "unit": "ohm",
      "realistic_range": [
        100,
        600
      ]
    }
  },
  "statement": "ホイートストンブリッジが平衡している。辺の抵抗が R1=100Ω、R2=200Ω、R3=150Ω のとき、未知抵抗 Rx〔Ω〕は?（R1 と Rx、R2 と R3 がそれぞれ対辺）",
  "figure": "<svg xmlns=\"http://www.w3.org/2000/svg\" viewBox=\"0 0 280 158\" role=\"img\" aria-label=\"ホイートストンブリッジ R1=100,R2=200,R3=150,Rx=300（平衡）\" font-family=\"system-ui,sans-serif\" font-size=\"13\"><title>ホイートストンブリッジ R1=100,R2=200,R3=150,Rx=300（平衡）</title><g stroke=\"currentColor\" stroke-width=\"2\" fill=\"none\" stroke-linecap=\"round\" stroke-linejoin=\"round\"><line x1=\"55\" y1=\"80\" x2=\"140\" y2=\"25\"/><line x1=\"140\" y1=\"25\" x2=\"225\" y2=\"80\"/><line x1=\"55\" y1=\"80\" x2=\"140\" y2=\"135\"/><line x1=\"225\" y1=\"80\" x2=\"140\" y2=\"135\"/><text x=\"78\" y=\"44\" fill=\"currentColor\" stroke=\"none\">R1=100</text><text x=\"185\" y=\"44\" fill=\"currentColor\" stroke=\"none\">R2=200</text><text x=\"74\" y=\"120\" fill=\"currentColor\" stroke=\"none\">Rx=300</text><text x=\"184\" y=\"120\" fill=\"currentColor\" stroke=\"none\">R3=150</text><line x1=\"55\" y1=\"80\" x2=\"225\" y2=\"80\"/><circle cx=\"140\" cy=\"80\" r=\"12\" fill=\"none\"/><text x=\"140\" y=\"84\" fill=\"currentColor\" stroke=\"none\" text-anchor=\"middle\">G</text><circle cx=\"140\" cy=\"25\" r=\"3.2\" fill=\"currentColor\" stroke=\"none\"/><circle cx=\"140\" cy=\"135\" r=\"3.2\" fill=\"currentColor\" stroke=\"none\"/><line x1=\"140\" y1=\"25\" x2=\"140\" y2=\"10\"/><line x1=\"140\" y1=\"135\" x2=\"140\" y2=\"150\"/><text x=\"148\" y=\"16\" fill=\"currentColor\" stroke=\"none\">電源</text></g></svg>",
  "answer": "300",
  "solution": [
    "平衡条件: 対辺の積が等しい R1·Rx=R2·R3",
    "Rx=R2·R3/R1=200×150/100",
    "Rx=300Ω"
  ],
  "validation": {
    "solver_checked": true,
    "human_checked": true,
    "clean_answer": true,
    "physically_valid": true,
    "supervisor_checked": false,
    "confidence": 0.97
  },
  "source": {
    "type": "original",
    "citation": "DENKEN-OS オリジナル問題"
  },
  "stats": {
    "answered": 0,
    "correct_rate": 0
  },
  "status": "validated"
}
