{
  "id": "T-0019",
  "exam": "denken2_secondary",
  "subject": "電力管理",
  "topic": "三相短絡容量",
  "format": "descriptive",
  "difficulty": 3,
  "params": {
    "base_capacity": {
      "value": 10,
      "unit": "MVA",
      "realistic_range": [
        10,
        100
      ]
    },
    "percent_impedance": {
      "value": 5,
      "unit": "%",
      "realistic_range": [
        4,
        25
      ]
    }
  },
  "statement": "基準容量 P_base=10MVA における系統のパーセントインピーダンスが %Z=5% である。この点での三相短絡容量 Ps〔MVA〕を導出過程とともに求めよ。",
  "answer": "200",
  "solution": [
    "短絡容量 Ps=P_base×100/%Z",
    "Ps=10×100/5",
    "Ps=200MVA"
  ],
  "validation": {
    "solver_checked": true,
    "human_checked": true,
    "clean_answer": true,
    "physically_valid": true,
    "supervisor_checked": false,
    "confidence": 0.97
  },
  "source": {
    "type": "original",
    "citation": "DENKEN-OS オリジナル問題"
  },
  "stats": {
    "answered": 0,
    "correct_rate": 0
  },
  "status": "validated"
}
