{
  "id": "T-0020",
  "exam": "denken2_secondary",
  "subject": "電力管理",
  "topic": "調相設備容量",
  "format": "descriptive",
  "difficulty": 4,
  "params": {
    "load_power": {
      "value": 1200,
      "unit": "kW",
      "realistic_range": [
        500,
        3000
      ]
    },
    "power_factor_before": {
      "value": 0.8,
      "unit": "",
      "realistic_range": [
        0.5,
        1
      ]
    },
    "power_factor_after": {
      "value": 1,
      "unit": "",
      "realistic_range": [
        0.5,
        1
      ]
    }
  },
  "statement": "有効電力 P=1200kW、力率 cosθ1=0.8（遅れ）の需要家が、力率を cosθ2=1 に改善する。必要な電力用コンデンサ（調相設備）容量 Qc〔kvar〕を導出過程とともに求めよ。",
  "answer": "900",
  "solution": [
    "改善前後の無効電力差が必要容量: Qc=P(tanθ1−tanθ2)",
    "tanθ1=0.75、tanθ2=0",
    "Qc=1200×(0.75−0)=900kvar"
  ],
  "validation": {
    "solver_checked": true,
    "human_checked": true,
    "clean_answer": true,
    "physically_valid": true,
    "supervisor_checked": false,
    "confidence": 0.97
  },
  "source": {
    "type": "original",
    "citation": "DENKEN-OS オリジナル問題"
  },
  "stats": {
    "answered": 0,
    "correct_rate": 0
  },
  "status": "validated"
}
