{
  "id": "T-0043",
  "exam": "denken2_secondary",
  "subject": "機械制御",
  "topic": "昇圧チョッパの出力電圧",
  "format": "descriptive",
  "difficulty": 3,
  "params": {
    "input_voltage": {
      "value": 100,
      "unit": "V",
      "realistic_range": [
        100,
        300
      ]
    },
    "duty_ratio": {
      "value": 0.5,
      "unit": "",
      "realistic_range": [
        0.1,
        0.9
      ]
    }
  },
  "statement": "直流 Vi=100V を昇圧チョッパで変換する。通流率 D=0.5（=50%）のとき、出力平均電圧 Vo〔V〕を導出過程とともに求めよ。",
  "answer": "200",
  "solution": [
    "昇圧チョッパの出力平均電圧 Vo=Vi/(1−D)（降圧の Vo=D·Vi と対）",
    "Vo=100/(1−0.5)",
    "Vo=200V"
  ],
  "validation": {
    "solver_checked": true,
    "human_checked": true,
    "clean_answer": true,
    "physically_valid": true,
    "supervisor_checked": false,
    "confidence": 0.97
  },
  "source": {
    "type": "original",
    "citation": "DENKEN-OS オリジナル問題"
  },
  "stats": {
    "answered": 0,
    "correct_rate": 0
  },
  "status": "validated"
}
