{
  "id": "T-0032",
  "exam": "denken3",
  "subject": "理論",
  "topic": "分流器",
  "format": "numeric",
  "difficulty": 2,
  "params": {
    "internal_resistance": {
      "value": 9,
      "unit": "Ω",
      "realistic_range": [
        1,
        100
      ]
    },
    "multiplier": {
      "value": 10,
      "unit": "",
      "realistic_range": [
        2,
        100
      ]
    }
  },
  "statement": "内部抵抗 r=9Ω の電流計の測定範囲を 10 倍にしたい。並列に接続する分流器の抵抗 R_s〔Ω〕は?",
  "answer": "1",
  "solution": [
    "分流器: 計器電流の (m−1) 倍を分流させる → R_s=r/(m−1)",
    "R_s=9/(10−1)",
    "R_s=1Ω"
  ],
  "validation": {
    "solver_checked": true,
    "human_checked": true,
    "clean_answer": true,
    "physically_valid": true,
    "supervisor_checked": false,
    "confidence": 0.97
  },
  "source": {
    "type": "original",
    "citation": "DENKEN-OS オリジナル問題"
  },
  "stats": {
    "answered": 0,
    "correct_rate": 0
  },
  "status": "validated"
}
